Nom table;Identifiant BDD;Donnée obligatoire;Type de donnée;Table de références;Champ récupéré (enum) ;Description
audit_etape_travaux;facture_gain_max;X;Numérique; ; ;économie sur les factures annuelles d'énergie de l'étape par rapport à l’étape précédente (€/an)
audit_etape_travaux;facture_gain_min;X;Numérique; ; ;économie sur les factures annuelles d'énergie de l'étape par rapport à l’étape précédente (€/an)
audit_etape_travaux;ef_conso_5_usages_m2_gain_cumule;X;Numérique; ; ;gain en énergie finale (totale 5 usages rapportée au m², déduit de la production pv autoconsommée) du scénario de travaux cumulé jusqu’à l’étape en cours inclus (kWhef/m²SHAB/an)
audit_etape_travaux;ep_conso_5_usages_m2_gain_cumule;X;Numérique; ; ;gain en énergie primaire (totale 5 usages rapportée au m², déduit de la production pv autoconsommée) du scénario de travaux cumulé jusqu’à l’étape en cours inclus (kWhep/m²SHAB/an)
audit_etape_travaux;emission_ges_5_usages_m2_gain_cumule;X;Numérique; ; ;réduction des GES (totale 5 usages rapportée au m², déduit de la production pv autoconsommée) du scénario de travaux cumulée jusqu’à l’étape en cours inclus (kgCO2eq/m²SHAB/an)
audit_etape_travaux;facture_gain_cumule_max;X;Numérique; ; ;économie sur les factures annuelles d'énergie de l'étape par rapport à l’état initial (€/an)
audit_etape_travaux;facture_gain_cumule_min;X;Numérique; ; ;économie sur les factures annuelles d'énergie de l'étape par rapport à l’état initial (€/an)
audit_etape_travaux;ef_conso_5_usages_m2_gain_cumule_relatif;X;Numérique; ; ;gain relatif en énergie finale (totale 5 usages rapportée au m², déduit de la production pv autoconsommée) du scénario de travaux cumulé jusqu’à l’étape en cours inclus (%)
audit_etape_travaux;ep_conso_5_usages_m2_gain_cumule_relatif;X;Numérique; ; ;gain relatif en énergie primaire (totale 5 usages rapportée au m², déduit de la production pv autoconsommée) du scénario de travaux cumulé jusqu’à l’étape en cours inclus (%)
audit_etape_travaux;emission_ges_5_usages_m2_gain_cumule_relatif;X;Numérique; ; ;réduction relative des GES (totale 5 usages rapportée au m², déduit de la production pv autoconsommée) du scénario de travaux cumulée jusqu’à l’étape en cours inclus (%)
audit_etape_travaux;classe_emission_ges;X;Texte; ; ;classe d'estimation ges du DPE 5 usages
audit_etape_travaux;ef_conso_5_usages_m2;X;Numérique; ; ;consommation annuelle 5 usages (déduit de la production pv autoconsommée) (ecs/chauffage/climatisation/eclairage/auxiliaires) en energie finale (kWhef/m²SHAB/an)
audit_etape_travaux;ef_conso_5_usages_m2_sans_ac;X;Numérique; ; ;consommation annuelle 5 usages (hors production pv autoconsommée) (ecs/chauffage/climatisation/eclairage/auxiliaires) en energie finale (kWhef/m²SHAB/an)
audit_etape_travaux;emission_ges_5_usages_m2;X;Numérique; ; ;emission GES totale 5 usages (déduit de la production pv autoconsommée)(ecs/chauffage/climatisation/eclairage/auxiliaires)(kgCO2eq/m²SHAB/an)
audit_etape_travaux;ep_conso_5_usages_m2;X;Numérique; ; ;consommation annuelle 5 usages (ecs/chauffage/climatisation/eclairage/auxiliaires) en energie primaire (déduit de la production pv autoconsommée) (kWhep/m²SHAB/an)
audit_etape_travaux;ep_conso_5_usages_m2_sans_ac;X;Numérique; ; ;consommation annuelle 5 usages (hors production pv autoconsommée) (ecs/chauffage/climatisation/eclairage/auxiliaires) en energie primaire (kWhep/m²SHAB/an)
audit_etape_travaux;aide_financiere_locale;X;Texte; ; ;mention des principales aides financières disponibles au niveau locale
audit_etape_travaux;aide_financiere_nationale;X;Texte; ; ;mention des principales aides financières disponibles au niveau nationale
audit_etape_travaux;logement_id;X; ;audit_logement; ;Identifiant technique du logement
audit_etape_travaux;date_derniere_modification;X;Date; ; ;Date de dernière modification de l'enregistrement
audit_etape_travaux;cout_min; ;Numérique; ; ;coût minimal des travaux de l’étape, dont les travaux auxiliaires permettant la bonne exécution (€TTC)
audit_etape_travaux;cout_max; ;Numérique; ; ;coût maximal des travaux de l’étape, dont les travaux auxiliaires permettant la bonne exécution (€TTC)
audit_etape_travaux;cout_cumule_min; ;Numérique; ; ;coût minimal cumulé du scénario de travaux jusqu’à l’étape en cours inclus, dont les travaux auxiliaires permettant la bonne exécution (€TTC)
audit_etape_travaux;cout_cumule_max; ;Numérique; ; ;coût maximal cumulé du scénario de travaux jusqu’à l’étape en cours inclus, dont les travaux auxiliaires permettant la bonne exécution (€TTC)
audit_etape_travaux_travaux_resume;enum_travaux_resume_collection_id;X; ;audit_enum_travaux_resume_collection;lib;travaux élémentaire à sélectionner par l'auditeur, pour affichage en p.8 de la trame de l'audit
audit_etape_travaux_travaux_resume;etape_travaux_id;X; ;a+K366+F365; ;travaux élémentaire sélectionné par l'auditeur
audit_etape_travaux_travaux_resume;date_derniere_modification;X;Date; ; ;Date de dernière modification de l'enregistrement
audit_etape_travaux_travaux_resume;enum_travaux_resume_id; ; ;audit_enum_travaux_resume; ;travaux élémentaire à sélectionner par l'auditeur, pour affichage en p.8 de la trame de l'audit
audit_ets;bver;X;Numérique; ; ;coefficient de reduction des déperditions de l'espace tampon solarisé
audit_ets;coef_transparence_ets;X;Numérique; ; ;coefficient de transparence de l'espace tampon solarisé T (déterminé à partir des parois vitrées de l'espace tampon solarisé)
audit_ets;description;Parfois;Texte; ; ;description textuelle de l'objet
audit_ets;enum_cfg_isolation_lnc_id;X; ;audit_enum_cfg_isolation_lnc; ;configuration de l'adjacence avec local non chauffé : local chauffé (non) isolé/local non chauffé (non) isolé/orientation véranda qui permet de calculer le b
audit_ets;enum_etat_composant_id;X; ;audit_enum_etat_composant;lib;indique si le composant a été changé par rapport au logement initial
audit_ets;id;X; ; ; ;Identifiant technique de l'espace tampon solarisé
audit_ets;logement_id;X; ;audit_logement; ;Identifiant technique du logement
audit_ets;reference;X;Texte; ; ;reference projet de l'objet (cette référence permet de faire d'éventuels liens entre objets). La codification et utilisation des références peut différer entre logiciels
audit_ets;tv_coef_reduction_deperdition_id; ; ;audit_tv_coef_reduction_deperdition; ;id de la ligne de la table utilisée pour le calcul du coefficient de reduction des deperditions
audit_ets;tv_coef_transparence_ets_id;X; ;audit_tv_coef_transparence_ets; ;id de la ligne de la table utilisée pour le calcul du coefficient de transparence de l'espace tampon solarisé
audit_ets;date_derniere_modification;X;Date; ; ;Date de dernière modification de l'enregistrement
audit_expertise_auditeur;audit_id;X; ;audit; ;Identifiant technique de l'AUDIT
audit_expertise_auditeur;explications_personnalisees; ;Texte; ; ;Explications personnalisées sur les éléments pouvant amener à des différences entre consommations estimées et réelles (trame p.6)
audit_expertise_auditeur;observations_auditeur; ;Texte; ; ;Observations de l'auditeur concernant l'état existant du bâtiment (trame p.7)
audit_expertise_auditeur;date_derniere_modification;X;Date; ; ;Date de dernière modification de l'enregistrement
audit_generateur_chauffage;conso_ch;X;Numérique; ; ;consommation d'energie annuelle du générateur de chauffage en energie finale kWh (exprimée en kWh PCI pour les combustibles). Dans le cas d'un DPE immeuble ou d'un DPE appartement à partir de l'immeuble c'est la consommation du générateur à l'immeuble qu'il faut saisir.
audit_generateur_chauffage;enum_type_energie_id;X; ;audit_enum_type_energie;lib;type d'énergie consommée par le générateur de chauffage
audit_generateur_chauffage;enum_type_generateur_ch_id;X; ;audit_enum_type_generateur_ch;lib;type de generateur de chauffage
audit_generateur_chauffage;enum_usage_generateur_id;X; ;audit_enum_usage_generateur;lib;usages assurés par le générateur (chauffage/ecs/chauffage+ecs)
audit_generateur_chauffage;enum_etat_composant_id;X; ;audit_enum_etat_composant;lib;indique si le composant a été changé par rapport au logement initial
audit_generateur_chauffage;conso_ch_depensier;X;Numérique; ; ;consommation d'énergie annuelle du générateur de chauffage pour le scénario dépensier (scénario DH21) en energie finale kWh (exprimée en kWh PCI pour les combustibles). Dans le cas d'un DPE immeuble ou d'un DPE appartement à partir de l'immeuble c'est la consommation du générateur à l'immeuble qu'il faut saisir.
audit_generateur_chauffage;date_arrete_reseau_chaleur; ; ; ; ;identifiant réseau de chaleur ou de froid utilisé (utilisé à partir du 18 janvier 2022)
audit_generateur_chauffage;description;Parfois;Texte; ; ;Identifiant technique du générateur de chauffage
audit_generateur_chauffage;enum_lien_generateur_emetteur_id;X; ;audit_enum_lien_generateur_emetteur; ;lien entre le générateur et l'émetteur associé
audit_generateur_chauffage;enum_methode_saisie_carac_sys_id;X; ;audit_enum_methode_saisie_carac_sys; ;méthode de saisie des performances du système de chauffage
audit_generateur_chauffage;id;X; ; ; ;Identifiant technique du générateur de chauffage
audit_generateur_chauffage;identifiant_reseau_chaleur; ;Texte; ; ;identifiant réseau de chaleur ou de froid utilisé (utilisé à partir du 18 janvier 2022). Cet identifiant doit correspondre à un identifiant déclaré dans la liste des réseaux de chaleurs spécifiés dans l'arrêté en vigueur qui modifie l'annexe 7 de l'arrêté du 15 septembre 2006 relatif au diagnostic de performance energétique
audit_generateur_chauffage;installation_chauffage_id;X; ;audit_installation_chauffage; ;Identifiant technique de l'installation de chauffage
audit_generateur_chauffage;n_radiateurs_gaz; ;Numérique; ; ;nombre de radiateurs gaz
audit_generateur_chauffage;pn; ;Numérique; ; ;puissance nominale du générateur à combustion (W)
audit_generateur_chauffage;position_volume_chauffe;X;Booléen; ; ;est ce que le générateur est positionné dans le volume chauffé. (pour le calcul des pertes de génération récupérables)
audit_generateur_chauffage;presence_regulation_combustion; ;Booléen; ; ;présence d'un organe de régulation pour le système de chauffage à combustion 0 : non 1 : oui
audit_generateur_chauffage;presence_ventouse; ;Booléen; ; ;présence d'un système de ventouse ou avec un ventilateur pour l'évacuation des fumées d'un système à combustion 0 : non 1 : oui
audit_generateur_chauffage;priorite_generateur_cascade; ;Numérique; ; ;ordre de priorité du générateur en cascade (ordonné de manière croissante 1 : générateur principal , 2: genérateur secondaire etc…). Dans le cas de deux générateurs en cascade sans priorité, les deux générateurs sont déclarés comme principal
audit_generateur_chauffage;pveilleuse; ;Numérique; ; ;puissance de la veilleuse du générateur à combustion (W)
audit_generateur_chauffage;qp0; ;Numérique; ; ;pertes à l'arret du générateur à combustion. Dans le cas d'un générateur virtualisé pour DPE appartement avec chauffage collectif saisir Qp0 correspondant à Pe = a*Pn(collectif) (W)
audit_generateur_chauffage;ref_produit_generateur_ch; ;Texte; ; ;référence produit et marque du générateur de chauffage
audit_generateur_chauffage;reference;X;Texte; ; ;reference projet de l'objet (cette référence permet de faire d'éventuels liens entre objets). La codification et utilisation des références peut différer entre logiciels
audit_generateur_chauffage;reference_generateur_mixte; ;Texte; ; ;référence commune pour un générateur mixte chauffage ECS. Cette référence est identique pour les deux parties du générateur (chauffage et ECS) et est utilisé pour faire le lien entre les deux
audit_generateur_chauffage;rendement_generation; ;Numérique; ; ;Rg : rendement de génération du système de chauffage pour tous les générateurs sauf thermodynamique. Pour les générateurs à combustion il faut saisir le rendement sur PCI (0-1,5)
audit_generateur_chauffage;rpint; ;Numérique; ; ;rendement de génération à charge intermédiaire du générateur à combustion (0-1,5)
audit_generateur_chauffage;rpn; ;Numérique; ; ;rendement de génération à pleine charge du générateur à combustion (0-1,5)
audit_generateur_chauffage;scop;Parfois;Numérique; ; ;scop du générateur thermodynamique (en remplacement du Rg pour les générateurs thermodynamique) (0-20)
audit_generateur_chauffage;temp_fonc_100; ;Numérique; ; ;température de fonctionnement à 100% de charge (°C)
audit_generateur_chauffage;temp_fonc_30; ;Numérique; ; ;température de fonctionnement à 30% de charge (°C)
audit_generateur_chauffage;tv_generateur_combustion_id; ; ;audit_tv_generateur_combustion; ;id de la ligne de la table utilisée pour le calcul des paramètres du générateur à combustion Rpn,Rpint,Qp0,Pveil
audit_generateur_chauffage;tv_rendement_generation_id; ; ;audit_tv_rendement_generation; ;id de la ligne de la table utilisée pour le calcul des rendements de générations forfaitaires des générateurs autres qu'à combustion
audit_generateur_chauffage;tv_reseau_chaleur_id; ; ;audit_tv_reseau_chaleur; ;id de la ligne de la table utilisée pour le calcul du contenu CO2 des réseaux de chaleurs (OBSOLETE et remplacé par identifiant_reseau_chaleur à partir du 18 janvier 2022 et la prise en compte du nouvel arrêté réseau de chaleur).
audit_generateur_chauffage;tv_scop_id; ; ;audit_tv_scop; ;id de la ligne de la table utilisée pour le calcul du coefficient de performance du système thermodynamique (SCOP)
audit_generateur_chauffage;tv_temp_fonc_100_id; ; ;audit_tv_temp_fonc_100; ;id de la ligne de la table utilisée pour le calcul de la température à 100% de charge du système à combustion(SUPPRIME)
audit_generateur_chauffage;tv_temp_fonc_30_id; ; ;audit_tv_temp_fonc_30; ;id de la ligne de la table utilisée pour le calcul de la température à 30% de charge du système à combustion(SUPPRIME)
audit_generateur_chauffage;migre_en_utc;X;Booléen; ; ;Indique si les dates de la table ont été migrées au format UTC
audit_generateur_chauffage;date_derniere_modification;X;Date; ; ;Date de dernière modification de l'enregistrement
audit_generateur_ecs;conso_ecs;X;Numérique; ; ;consommation d'energie annuelle du générateur d'ECS (kWh) (Exprimé en kWh PCI pour les combustibles ). Dans le cas d'un DPE immeuble ou d'un DPE appartement à partir de l'immeuble c'est la consommation du générateur à l'immeuble qu'il faut saisir.
audit_generateur_ecs;cop; ;Numérique; ; ;COP du chauffe-eau thermodynamique (inclus le rendement de stockage) (0-20)
audit_generateur_ecs;enum_periode_installation_ecs_thermo_id; ; ;audit_enum_periode_installation_ecs_thermo;lib;periode installation du système thermodynamique
audit_generateur_ecs;enum_type_energie_id;X; ;audit_enum_type_energie;lib;type d'énergie consommée par le générateur d'ECS
audit_generateur_ecs;enum_type_generateur_ecs_id;X; ;audit_enum_type_generateur_ecs;lib;type de generateur d'ecs
audit_generateur_ecs;enum_usage_generateur_id;X; ;audit_enum_usage_generateur;lib;usages assurés par le générateur (chauffage/ecs/chauffage+ecs)
audit_generateur_ecs;volume_stockage;X;Numérique; ; ;volume de stockage associé au générateur d'ECS
audit_generateur_ecs;conso_ecs_depensier;X;Numérique; ; ;consommation d'énergie annuelle du générateur d'ECS pour le scénario dépensier en énergie finale (kWh) (Exprimé en kWh PCI pour les combustibles ). Dans le cas d'un DPE immeuble ou d'un DPE appartement à partir de l'immeuble c'est la consommation du générateur à l'immeuble qu'il faut saisir.
audit_generateur_ecs;date_arrete_reseau_chaleur; ; ; ; ;"date de l'arrêté qui modifie l'annexe 7 de l'arrêté du 15 septembre 2006 relatif au diagnostic de performance énergétique. (https://www.legifrance.gouv.fr/loda/id/JORFTEXT000000788395?isAdvancedResult=&amp;page=3&amp;pageSize=10&amp;query=Arr%C3%AAt%C3%A9+relatif+au+classement+des+r%C3%A9seaux+de+chaleur+et+de+froid&amp;searchField=ALL&amp;searchProximity=&amp;searchType=ALL&amp;tab_selection=all&amp;typePagination=DEFAULT). L'arrêté publie la liste des réseaux de chaleurs référencés pour le calcul du DPE et publie les taux de CO2 et ENR associés. La fréquence de ces arrêtés est d'une année en général mais ils ne sont pas publiés à des dates stables. Ce champ est obligatoire lorsqu'un réseau de chaleur est renseigné. les informations sur les arrêtés de réseaux de chaleur sont disponibles dans observatoire_dpe.modele_donnee.arrete_reseau_chaleur.json"
audit_generateur_ecs;description;Parfois;Texte; ; ;description textuelle de l'objet
audit_generateur_ecs;enum_etat_composant_id;X; ;audit_enum_etat_composant; ;indique si le composant a été changé par rapport au logement initial
audit_generateur_ecs;enum_methode_saisie_carac_sys_id;X; ;audit_enum_methode_saisie_carac_sys; ;méthode de saisie des performances du système d'ECS
audit_generateur_ecs;enum_type_stockage_ecs_id;X; ;audit_enum_type_stockage_ecs; ;Type de stockage d'ECS (intégré à la production ou indépendant)
audit_generateur_ecs;id;X; ; ; ;Identifiant technique du générateur d'ECS
audit_generateur_ecs;identifiant_reseau_chaleur; ;Texte; ; ;identifiant réseau de chaleur ou de froid utilisé (utilisé à partir du 18 janvier 2022). Cet identifiant doit correspondre à un identifiant déclaré dans la liste des réseaux de chaleurs spécifiés dans l'arrêté en vigueur qui modifie l'annexe 7 de l'arrêté du 15 septembre 2006 relatif au diagnostic de performance energétique
audit_generateur_ecs;installation_ecs_id;X; ;audit_installation_ecs; ;Identifiant technique de l'installation d'ECS
audit_generateur_ecs;pn; ;Numérique; ; ;puissance nominale du générateur à combustion. Dans le cas d'un générateur virtualisé pour DPE appartement avec ECS collective saisir Pe = a*Pn(collectif) (W)
audit_generateur_ecs;position_volume_chauffe;X;Booléen; ; ;est ce que le générateur est positionné dans le volume chauffé. (pour le calcul des pertes de génération récupérables)
audit_generateur_ecs;position_volume_chauffe_stockage; ;Numérique; ; ;est ce que le ballon de stockage est positionné dans le volume chauffé. (pour le calcul des pertes de stockage récupérables)
audit_generateur_ecs;presence_ventouse; ;Numérique; ; ;présence d'un système de ventouse ou avec un ventilateur pour l'évacuation des fumées d'un système à combustion 0 : non 1 : oui
audit_generateur_ecs;pveilleuse; ;Numérique; ; ;puissance de la veilleuse du générateur à combustion (W)
audit_generateur_ecs;qp0; ;Numérique; ; ;pertes à l'arret du générateur à combustion. Dans le cas d'un générateur virtualisé pour DPE appartement avec ECS collective saisir Qp0 correspondant à Pe = a*Pn(collectif)
audit_generateur_ecs;ratio_besoin_ecs;X;Numérique; ; ;ratio du besoin ecs de l'installation affecté au générateur. Ce ratio est de 1 pour les installations classiques et de 0,5 pour les installations d'ECS avec deux générateurs
audit_generateur_ecs;ref_produit_generateur_ecs; ;Texte; ; ;référence produit et marque du générateur d'ECS
audit_generateur_ecs;reference;X;Texte; ; ;reference projet de l'objet (cette référence permet de faire d'éventuels liens entre objets). La codification et utilisation des références peut différer entre logiciels
audit_generateur_ecs;reference_generateur_mixte; ;Texte; ; ;référence commune pour un générateur mixte chauffage ECS. Cette référence est identique pour les deux parties du générateur (chauffage et ECS) et est utilisé pour faire le lien entre les deux
audit_generateur_ecs;rendement_generation; ;Numérique; ; ;Rg : rendement de génération dans le cas où le rendement de stockage est séparé du rendement de génération (ballon éléctrique ou ballon séparé de la production) (0-1,5)
audit_generateur_ecs;rendement_generation_stockage; ;Numérique; ; ;RgxRs : rendement de génération x rendement de stockage pour les systèmes pour lesquels le ballon est intégré au système de production ou réseau de chaleur (0-1,5)
audit_generateur_ecs;rendement_stockage; ;Numérique; ; ;Rs : rendement de stockage dans le cas où le rendement de stockage est séparé du rendement de génération (ballon éléctrique ou ballon séparé de la production) sinon égal à 1 (0-1)
audit_generateur_ecs;rpn; ;Numérique; ; ;rendement de génération à pleine charge du générateur à combustion (0-1,5)
audit_generateur_ecs;tv_generateur_combustion_id; ; ;audit_tv_generateur_combustion; ;id de la ligne de la table utilisée pour le calcul des paramètres du générateur à combustion Rpn,Rpint,Qp0,Pveil
audit_generateur_ecs;tv_pertes_stockage_id; ; ;audit_tv_pertes_stockage; ;id de la ligne de la table utilisée pour le calcul des pertes de stockage pour les ballons éléctriques
audit_generateur_ecs;tv_reseau_chaleur_id; ; ;audit_tv_reseau_chaleur; ;id de la ligne de la table utilisée pour le calcul du contenu CO2 des réseaux de chaleurs (OBSOLETE et remplacé par identifiant_reseau_chaleur à partir du 18 janvier 2022 et la prise en compte du nouvel arrêté réseau de chaleur).
audit_generateur_ecs;tv_scop_id; ; ;audit_tv_scop; ;id de la ligne de la table utilisée pour le calcul du coefficient de performance du système thermodynamique (SCOP)
audit_generateur_ecs;migre_en_utc;X;Booléen; ; ;Indique si les dates de la table ont été migrées au format UTC
audit_generateur_ecs;date_derniere_modification;X;Date; ; ;Date de dernière modification de l'enregistrement
audit_geolocalisation;id_batiment_rnb; ;Texte; ; ;identifiant batiment du Référentiel National des Bâtiments (RNB) à venir sur les bâtiments en France (https://beta.gouv.fr/startups/bat-id.html)
audit_geolocalisation;immatriculation_copropriete; ;Texte; ; ;numéro d'immatriculation de la copropriété au registre des copropriétés (9 caractères XX0000000)
audit_geolocalisation;provenance_rnb; ;Texte; ; ;Origine de l'identifiant bâtiment du Référentiel National des Bâtiments (RNB)
audit_geolocalisation;administratif_id;X; ;audit_administratif; ;Identifiant technique de l'AUDIT
audit_geolocalisation;adresse_bien_id;X; ;audit_t_adresse; ;Adresse bien
audit_geolocalisation;idpar; ;Texte; ; ;identifiant de parcelle cadastrale (14 caractères)
audit_geolocalisation;date_derniere_modification;X;Date; ; ;Date de dernière modification de l'enregistrement
audit_increment;annee; ;Texte; ; ;Année de l'incrément
audit_increment;id;X; ; ; ;Identifiant technique de l'incrément
audit_increment;increment;X;Numérique; ; ;Incrément du numéro d'AUDIT
audit_increment;date_derniere_modification;X;Date; ; ;Date de dernière modification de l'enregistrement
audit_inertie;enum_classe_inertie_id;X; ;audit_enum_classe_inertie;lib;classe d'inertie globale du bâtiment
audit_inertie;inertie_paroi_verticale_lourd;X;Numérique; ; ;est ce que les parois verticales sont considérées comme lourdes 0 : non 1 : oui
audit_inertie;inertie_plancher_bas_lourd;X;Numérique; ; ;est ce que le plancher bas est considéré comme lourd 0 : non 1 : oui
audit_inertie;inertie_plancher_haut_lourd;X;Numérique; ; ;est ce que le plancher haud est considéré comme lourd 0 : non 1 : oui
audit_inertie;logement_id;X; ;audit_logement; ;Identifiant technique du logement
audit_inertie;date_derniere_modification;X;Date; ; ;Date de dernière modification de l'enregistrement
audit_installation_chauffage;enum_cfg_installation_ch_id;X; ;audit_enum_cfg_installation_ch;lib;configuration de l'installation de chauffage
audit_installation_chauffage;conso_ch;X;Numérique; ; ;consommation d'energie annuelle de l'installation de chauffage en energie finale kWh. Dans le cas d'un DPE immeuble ou d'un DPE appartement à partir de l'immeuble c'est la consommation de l'installation à l'immeuble qu'il faut saisir.
audit_installation_chauffage;enum_etat_composant_id;X; ;audit_enum_etat_composant;lib;indique si le composant a été changé par rapport au logement initial
audit_installation_chauffage;fch; ;Numérique; ; ;Facteur de couverture solaire pour l'installation de chauffage
audit_installation_chauffage;fch_saisi; ;Numérique; ; ;Facteur de couverture solaire pour l'installation de chauffage(saisi)
audit_installation_chauffage;surface_chauffee;X;Numérique; ; ;surface chauffée par l'installation de chauffage(surface du logement ou de l'immeuble). Dans le cas spécifique d'un DPE immeuble avec installation individuelle échantillonée :saisir la surface chauffée de la totalité des logements représentés par le logement moyen surface_habitable= Shmoy*Nblgt. Dans le cas d'un DPE immeuble ou d'un DPE appartement à partir de l'immeuble c'est la surface de l'installation à l'immeuble qu'il faut renseigner
audit_installation_chauffage;enum_type_installation_id;X; ;audit_enum_type_installation;lib;type d'installation de chauffage (collective ou individuelle ou collective multi batiment
audit_installation_chauffage;besoin_ch;X;Numérique; ; ;Besoin de chauffage total de l'installation (kWh)
audit_installation_chauffage;besoin_ch_depensier;X;Numérique; ; ;Besoin de chauffage total de l'installation pour le scénario dépensier (DH21) (kWh)
audit_installation_chauffage;cle_repartition_ch; ;Numérique; ; ;clé de répartition pour passer des consommations bâtiments au consommation logement dans le cas DPE appartement calculé à partir du DPE immeuble UNIQUEMENT. Voir section 8.5.4 du document guide pour plus de détail
audit_installation_chauffage;coef_ifc; ;Numérique; ; ;coefficient d'individualisation des frais de chauffage dans le cas d'un DPE appartement calculé à partir d'un DPE immeuble
